{
  "$schema": "https://json-schema.org/draft/2020-12/schema",
  "$id": "https://skenion.dev/schemas/object-spec/v0.1/parse-result.schema.json",
  "title": "skenion Object Spec Parse Result v0.1",
  "type": "object",
  "required": [
    "schema",
    "schemaVersion",
    "input",
    "ok",
    "className",
    "creationArgs",
    "params",
    "instancePorts",
    "displayText",
    "issues"
  ],
  "properties": {
    "schema": {
      "const": "skenion.object-spec.parse-result"
    },
    "schemaVersion": {
      "const": "0.1.0"
    },
    "input": {
      "type": "string",
      "minLength": 1
    },
    "ok": {
      "type": "boolean"
    },
    "className": {
      "type": "string",
      "minLength": 1
    },
    "creationArgs": {
      "type": "array",
      "items": {
        "$ref": "#/$defs/atom"
      }
    },
    "implementation": {
      "$ref": "#/$defs/objectImplementation"
    },
    "objectResolution": {
      "$ref": "#/$defs/objectResolution"
    },
    "params": {
      "type": "object",
      "additionalProperties": true
    },
    "instancePorts": {
      "type": "array",
      "items": {
        "$ref": "#/$defs/port"
      }
    },
    "displayText": {
      "type": "string",
      "minLength": 1
    },
    "issues": {
      "type": "array",
      "items": {
        "$ref": "#/$defs/issue"
      }
    }
  },
  "allOf": [
    {
      "if": {
        "properties": {
          "objectResolution": {
            "type": "object",
            "properties": {
              "status": {
                "const": "resolved"
              }
            },
            "required": ["status"]
          }
        },
        "required": ["objectResolution"]
      },
      "then": {
        "required": ["implementation"]
      }
    },
    {
      "if": {
        "properties": {
          "objectResolution": {
            "type": "object",
            "properties": {
              "status": {
                "const": "unresolved"
              }
            },
            "required": ["status"]
          }
        },
        "required": ["objectResolution"]
      },
      "then": {
        "not": {
          "required": ["implementation"]
        }
      }
    },
    {
      "if": {
        "properties": {
          "objectResolution": {
            "type": "object",
            "properties": {
              "status": {
                "const": "error"
              }
            },
            "required": ["status"]
          }
        },
        "required": ["objectResolution"]
      },
      "then": {
        "required": ["implementation"],
        "properties": {
          "objectResolution": {
            "type": "object",
            "required": ["issues"],
            "properties": {
              "issues": {
                "type": "array",
                "items": {
                  "$ref": "#/$defs/objectResolutionIssue"
                },
                "minItems": 1,
                "contains": {
                  "type": "object",
                  "properties": {
                    "code": {
                      "enum": [
                        "implementation-missing",
                        "implementation-stale",
                        "implementation-lock-mismatch",
                        "interface-drift"
                      ]
                    }
                  },
                  "required": ["code"]
                }
              }
            }
          }
        }
      }
    }
  ],
  "additionalProperties": false,
  "$defs": {
    "atom": {
      "type": "object",
      "required": ["type", "value"],
      "properties": {
        "type": {
          "enum": ["float", "int", "uint", "bool", "identifier", "string"]
        },
        "value": {
          "anyOf": [
            {
              "type": "number"
            },
            {
              "type": "boolean"
            },
            {
              "type": "string"
            }
          ]
        },
        "representation": {
          "type": "string",
          "minLength": 1
        }
      },
      "additionalProperties": false
    },
    "objectProvider": {
      "oneOf": [
        {
          "type": "object",
          "required": ["kind"],
          "properties": {
            "kind": {
              "const": "core"
            }
          },
          "additionalProperties": false
        },
        {
          "type": "object",
          "required": ["kind", "patchId"],
          "properties": {
            "kind": {
              "const": "projectPatch"
            },
            "patchId": {
              "type": "string",
              "minLength": 1
            },
            "revision": {
              "type": "string",
              "minLength": 1
            },
            "interfaceRevision": {
              "type": "string",
              "minLength": 1
            },
            "interfaceDigest": {
              "$ref": "#/$defs/checksum"
            }
          },
          "additionalProperties": false
        },
        {
          "type": "object",
          "required": ["kind", "packageId"],
          "properties": {
            "kind": {
              "const": "package"
            },
            "packageId": {
              "$ref": "#/$defs/packageId"
            },
            "lockEntryId": {
              "type": "string",
              "minLength": 1
            },
            "version": {
              "type": "string",
              "minLength": 1
            }
          },
          "additionalProperties": false
        }
      ]
    },
    "objectImplementation": {
      "type": "object",
      "required": ["provider", "objectId"],
      "properties": {
        "provider": {
          "$ref": "#/$defs/objectProvider"
        },
        "objectId": {
          "type": "string",
          "minLength": 1
        },
        "version": {
          "type": "string",
          "minLength": 1
        },
        "interfaceDigest": {
          "$ref": "#/$defs/checksum"
        }
      },
      "additionalProperties": false
    },
    "objectResolution": {
      "type": "object",
      "required": ["status"],
      "properties": {
        "status": {
          "enum": ["resolved", "unresolved", "error"]
        },
        "selectedSpec": {
          "type": "string",
          "minLength": 1
        },
        "candidates": {
          "type": "array",
          "items": {
            "$ref": "#/$defs/objectResolutionCandidate"
          }
        },
        "issues": {
          "type": "array",
          "items": {
            "$ref": "#/$defs/objectResolutionIssue"
          }
        }
      },
      "additionalProperties": false
    },
    "objectResolutionIssue": {
      "type": "object",
      "required": ["severity", "code", "message"],
      "properties": {
        "severity": {
          "enum": ["error", "warning", "info"]
        },
        "code": {
          "enum": [
            "resolution-unresolved",
            "resolution-ambiguous",
            "implementation-missing",
            "implementation-stale",
            "implementation-lock-mismatch",
            "interface-drift"
          ]
        },
        "message": {
          "type": "string",
          "minLength": 1
        },
        "details": true
      },
      "additionalProperties": false
    },
    "objectResolutionCandidate": {
      "type": "object",
      "required": ["implementation"],
      "properties": {
        "implementation": {
          "$ref": "#/$defs/objectImplementation"
        },
        "objectSpec": {
          "type": "string",
          "minLength": 1
        },
        "displayName": {
          "type": "string",
          "minLength": 1
        },
        "reason": {
          "type": "string",
          "minLength": 1
        }
      },
      "additionalProperties": false
    },
    "packageId": {
      "type": "string",
      "pattern": "^[a-z0-9](?:[a-z0-9-]*[a-z0-9])?/[a-z0-9](?:[a-z0-9-]*[a-z0-9])?$"
    },
    "checksum": {
      "type": "object",
      "required": ["algorithm", "value"],
      "properties": {
        "algorithm": {
          "const": "sha256"
        },
        "value": {
          "type": "string",
          "pattern": "^[a-fA-F0-9]{64}$"
        }
      },
      "additionalProperties": false
    },
    "port": {
      "type": "object",
      "required": ["id", "direction", "type"],
      "properties": {
        "id": {
          "type": "string",
          "minLength": 1
        },
        "direction": {
          "enum": ["input", "output"]
        },
        "type": {
          "type": "string",
          "minLength": 1
        },
        "rate": {
          "enum": ["event", "control", "audio", "render", "gpu", "resource", "io"]
        },
        "accepts": {
          "$ref": "#/$defs/typeList"
        },
        "activation": {
          "enum": ["trigger", "latched", "passive"]
        },
        "defaultValue": true,
        "messageKeys": {
          "$ref": "#/$defs/messageKeys"
        },
        "description": {
          "type": "string"
        }
      },
      "additionalProperties": false
    },
    "typeList": {
      "type": "array",
      "items": {
        "type": "string",
        "minLength": 1
      },
      "minItems": 1,
      "uniqueItems": true
    },
    "messageKeys": {
      "type": "object",
      "required": ["accepted"],
      "properties": {
        "accepted": {
          "$ref": "#/$defs/messageKeyList"
        },
        "silent": {
          "$ref": "#/$defs/messageKeyList"
        },
        "trigger": {
          "$ref": "#/$defs/messageKeyList"
        },
        "store": {
          "$ref": "#/$defs/messageKeyList"
        },
        "emit": {
          "$ref": "#/$defs/messageKeyList"
        }
      },
      "additionalProperties": false
    },
    "messageKeyList": {
      "type": "array",
      "items": {
        "type": "string",
        "minLength": 1,
        "pattern": "^[A-Za-z_][A-Za-z0-9_.:-]*$"
      },
      "minItems": 1,
      "uniqueItems": true
    },
    "issue": {
      "type": "object",
      "required": ["severity", "code", "message"],
      "properties": {
        "severity": {
          "enum": ["error", "warning", "info"]
        },
        "code": {
          "type": "string",
          "minLength": 1
        },
        "message": {
          "type": "string",
          "minLength": 1
        }
      },
      "additionalProperties": false
    }
  }
}
