{
  "schema": "skenion.object-spec.parse-result",
  "schemaVersion": "0.1.0",
  "input": "[phasor~ 1]",
  "ok": true,
  "className": "phasor~",
  "creationArgs": [
    {
      "type": "int",
      "value": 1,
      "representation": "i32"
    }
  ],
  "params": {},
  "instancePorts": [],
  "displayText": "phasor~ 1",
  "issues": []
}
