{
  "schema": "skenion.object-spec.parse-result",
  "schemaVersion": "0.1.0",
  "input": "[/ 0.5]",
  "ok": true,
  "className": "/",
  "creationArgs": [
    {
      "type": "float",
      "value": 0.5,
      "representation": "f32"
    }
  ],
  "params": {},
  "instancePorts": [],
  "displayText": "/ 0.5",
  "issues": []
}
